{
  "versao": 1,
  "id": "01K0000000000000000000N001",
  "leitura_id": "01K0000000000000000000C001",
  "sha256_audio": "bbbbbbbbbbbbbbbbbbbbbbbbbbbbbbbbbbbbbbbbbbbbbbbbbbbbbbbbbbbbbbbb",
  "voz_sha256": "cccccccccccccccccccccccccccccccccccccccccccccccccccccccccccccccc",
  "jobs_colab": [
    "job_abc123",
    "job_def456"
  ],
  "receita": "margem-poesia-omnivoice",
  "duracao_s": 20.5,
  "transicao": {
    "silencio_antes_s": 0.6,
    "silencio_depois_s": 0.4,
    "sinal": true,
    "contraste": false
  },
  "falas": [
    {
      "fala_id": "t0001",
      "inicio_s": 0,
      "fim_s": 3.1
    },
    {
      "fala_id": "p001",
      "inicio_s": 4.2,
      "fim_s": 8.0
    },
    {
      "fala_id": "t0002",
      "inicio_s": 8.6,
      "fim_s": 10.4
    },
    {
      "fala_id": "t0003",
      "inicio_s": 10.8,
      "fim_s": 14.0
    },
    {
      "fala_id": "p002",
      "inicio_s": 15.0,
      "fim_s": 20.3
    }
  ],
  "palavras": [
    {
      "bloco_id": "01K0000000000000000000B001",
      "inicio_utf16": 0,
      "fim_utf16": 9,
      "inicio_s": 0.05,
      "fim_s": 0.6
    },
    {
      "bloco_id": "01K0000000000000000000B001",
      "inicio_utf16": 10,
      "fim_utf16": 22,
      "inicio_s": 0.01,
      "fim_s": 1.3
    }
  ],
  "criado_em": "2026-09-29T23:30:00.000Z"
}
